{
  "$schema": "https://json-schema.org/draft/2020-12/schema",
  "additionalProperties": false,
  "description": "VeilConfigDefinition is the contents of .veil/veil.json — the\n hand-authored source-side project configuration. The \"Definition\"\n suffix marks it as a local-file shape; types under registry.proto\n (Kind, Registry, …) are the corresponding published forms.",
  "patternProperties": {
    "^(cliVersion)$": {
      "default": "",
      "description": "Minimum veil CLI version required to render this project, as a semver\n string (leading \"v\" optional, e.g. \"v1.4.0\"). When `veil render` runs\n on an older *released* build, it auto-updates to this version and\n re-execs so the render proceeds on a compatible CLI. Builds whose\n version isn't a comparable release (dev / edge) skip the check; unset\n means no minimum is enforced.",
      "type": "string"
    },
    "^(resourceDiscovery)$": {
      "additionalProperties": false,
      "description": "Where to find the resource JSON files that make up the project's\n catalog. Used at render time to resolve dependency targets.",
      "properties": {
        "paths": {
          "description": "Glob patterns identifying resource JSON files. Files that don't\n parse as a Resource shape (overlays, fragments, schemas) are\n skipped silently; duplicate (kind, name) pairs across matches are\n rejected.",
          "items": {
            "minLength": 1,
            "type": "string"
          },
          "type": "array"
        }
      },
      "title": "Resource Discovery",
      "type": "object"
    }
  },
  "properties": {
    "cli_version": {
      "default": "",
      "description": "Minimum veil CLI version required to render this project, as a semver\n string (leading \"v\" optional, e.g. \"v1.4.0\"). When `veil render` runs\n on an older *released* build, it auto-updates to this version and\n re-execs so the render proceeds on a compatible CLI. Builds whose\n version isn't a comparable release (dev / edge) skip the check; unset\n means no minimum is enforced.",
      "type": "string"
    },
    "generators": {
      "additionalProperties": false,
      "description": "Optional defaults for the source-side scaffolding commands\n (`veil init`, `veil new kind`, `veil new hook`). When unset, every\n generator falls back to its built-in default.",
      "patternProperties": {
        "^(kindsDir)$": {
          "default": "",
          "description": "Directory where `veil new kind` writes a new kind's tree, relative\n to the directory housing veil.json. `veil new hook` follows the\n existing kind on disk so this only affects newly created kinds.\n Defaults to `.veil/kinds` when unset.",
          "type": "string"
        },
        "^(sharedTypes)$": {
          "default": "",
          "description": "Path (relative to the directory housing veil.json) where `veil build`\n writes a single shared veil-types module holding the kind-independent\n type declarations (the host APIs Std/Os/Fetch, File, Resource,\n RegistryVariables, ValidationIssue/Result). When set, each per-hook\n veil-types.ts imports those symbols from this module instead of\n inlining them, so a change to a shared type touches one file instead\n of every generated veil-types.ts. When unset, the shared types are\n inlined into every file (the original behavior).",
          "type": "string"
        }
      },
      "properties": {
        "kinds_dir": {
          "default": "",
          "description": "Directory where `veil new kind` writes a new kind's tree, relative\n to the directory housing veil.json. `veil new hook` follows the\n existing kind on disk so this only affects newly created kinds.\n Defaults to `.veil/kinds` when unset.",
          "type": "string"
        },
        "shared_types": {
          "default": "",
          "description": "Path (relative to the directory housing veil.json) where `veil build`\n writes a single shared veil-types module holding the kind-independent\n type declarations (the host APIs Std/Os/Fetch, File, Resource,\n RegistryVariables, ValidationIssue/Result). When set, each per-hook\n veil-types.ts imports those symbols from this module instead of\n inlining them, so a change to a shared type touches one file instead\n of every generated veil-types.ts. When unset, the shared types are\n inlined into every file (the original behavior).",
          "type": "string"
        }
      },
      "title": "Generators",
      "type": "object"
    },
    "kinds": {
      "description": "Relative or absolute paths to kind definition files. May be empty —\n a project with no kinds is valid (it can still depend on kinds\n published by aliased registries).",
      "items": {
        "minLength": 1,
        "type": "string"
      },
      "type": "array"
    },
    "registries": {
      "additionalProperties": {
        "minLength": 1,
        "pattern": "^([^:]+|https?://.+)$",
        "type": "string"
      },
      "description": "Aliased registry sources keyed by alias. The empty-string alias\n (`\"\"`) is the default registry: kind references with no `\u003calias\u003e/`\n prefix resolve there. Named aliases can be any string and are used\n verbatim in references — declaring\n `\"acme\": \"./vendor/acme/registry.json\"` lets resources reference\n its kinds as `acme/\u003ckind\u003e`. The `@`-prefixed convention (e.g.\n `\"@scope\": \"...\"` referenced as `@scope/\u003ckind\u003e`) is supported but\n not required — the alias is treated as opaque text. Values are\n paths to compiled registry.json files (or URLs, when the loader\n supports them).",
      "propertyNames": {
        "pattern": "^([^.:/][^:/]*)?$",
        "type": "string"
      },
      "type": "object"
    },
    "resource_discovery": {
      "additionalProperties": false,
      "description": "Where to find the resource JSON files that make up the project's\n catalog. Used at render time to resolve dependency targets.",
      "properties": {
        "paths": {
          "description": "Glob patterns identifying resource JSON files. Files that don't\n parse as a Resource shape (overlays, fragments, schemas) are\n skipped silently; duplicate (kind, name) pairs across matches are\n rejected.",
          "items": {
            "minLength": 1,
            "type": "string"
          },
          "type": "array"
        }
      },
      "title": "Resource Discovery",
      "type": "object"
    },
    "variables": {
      "additionalProperties": {
        "additionalProperties": false,
        "description": "Variable declares a named input available to overlay regex matches\n (and to hooks via the render context). Lives in both the local\n VeilConfigDefinition and the published Kind (carried verbatim\n through compilation), so it has no Definition suffix — the same\n shape applies in both contexts.",
        "properties": {
          "default": {
            "description": "Optional default. If omitted, the variable is required at render time.\n Must be a scalar matching the declared type.",
            "title": "Value"
          },
          "description": {
            "description": "Optional human-readable description. Rendered as a JSDoc comment on\n the field in the generated veil-types.ts RegistryVariables interface\n so hook authors get inline documentation at their IDE cursor.",
            "type": "string"
          },
          "enum": {
            "description": "Optional set of permitted values. Only valid for `string` and `number`\n types. When present, the generated TypeScript field becomes a union\n (\"a\" | \"b\" | \"c\") instead of the broad scalar type, and values\n supplied via --var or VEIL_VAR_* are rejected at render time unless\n they match one of the listed entries.",
            "items": {
              "title": "Value"
            },
            "type": "array"
          },
          "type": {
            "description": "Declared type. Must be one of the legal VariableType.Enum values\n (the `unspecified` zero is rejected at load time).",
            "enum": [
              "unspecified",
              "string",
              "number",
              "bool"
            ],
            "title": "Enum",
            "type": "string"
          }
        },
        "title": "Variable",
        "type": "object"
      },
      "description": "User-defined input variables keyed by name. Values are provided at\n render time via --var flags or VEIL_VAR_\u003cNAME\u003e environment variables.",
      "propertyNames": {
        "pattern": "^[a-zA-Z_][a-zA-Z0-9_]*$",
        "type": "string"
      },
      "type": "object"
    }
  },
  "required": [
    "registries"
  ],
  "title": "Veil Config Definition",
  "type": "object"
}